{
  "schema_version": "chatlog.v1",
  "project_id": "project-123",
  "time_base": "epoch_ms",
  "source": {
    "bucket": "lang-live-video-editor-raw-dev-979287128595",
    "key": "tenant=demo/project=project-123/source/chat.csv",
    "version_id": "sample"
  },
  "video_start_epoch_ms": 1752487200000,
  "started_at_epoch_ms": 1752487200000,
  "ended_at_epoch_ms": 1752487440000,
  "message_count": 6,
  "filter": {
    "spam_ruleset_version": "spam-1.0.0",
    "kept_kinds": ["msg"]
  },
  "minute_buckets": [
    { "minute_index": 0, "start_epoch_ms": 1752487200000, "human_count": 4, "is_hot": false },
    { "minute_index": 1, "start_epoch_ms": 1752487260000, "human_count": 31, "is_hot": true },
    { "minute_index": 2, "start_epoch_ms": 1752487320000, "human_count": 34, "is_hot": true }
  ],
  "messages": [
    { "message_id": "m-0001", "time_ms": 1752487212000, "username": "viewerA", "text": "先卡個位子", "kind": "human", "is_spam": false },
    { "message_id": "m-0002", "time_ms": 1752487233000, "username": "botX", "text": "輸入浪🌊ID 追蹤主播抽好禮", "kind": "bot", "is_spam": true, "spam_rule": "promo_id" },
    { "message_id": "m-0003", "time_ms": 1752487265500, "username": "viewerB", "text": "哇這個真的太扯了！", "kind": "human", "is_spam": false },
    { "message_id": "m-0004", "time_ms": 1752487266200, "username": "viewerC", "text": "太神了吧 起雞皮疙瘩 XDDD", "kind": "human", "is_spam": false },
    { "message_id": "m-0005", "time_ms": 1752487290000, "username": "viewerD", "text": "主播晚上好唷～～", "kind": "human", "is_spam": true, "spam_rule": "canned_greeting" },
    { "message_id": "m-0006", "time_ms": 1752487353000, "username": "viewerE", "text": "成功了！太爽了吧 感謝應援！", "kind": "human", "is_spam": false }
  ],
  "created_at": "2026-07-14T10:02:00Z"
}
